{
  "$schema": "http://json-schema.org/draft-07/schema#",
  "title": "Routine Configuration Schema",
  "description": "Schema for data.json configuration file",
  "type": "object",
  "required": ["tasks", "routines", "routineTasks", "users", "settings", "routineAssignments", "flows", "schedules", "rewards"],
  "additionalProperties": false,
  "properties": {
    "chores": {
      "type": "array",
      "description": "Household chores and bonus activities that children can claim and complete for stars",
      "items": {
        "type": "object",
        "required": ["id", "title", "icon", "defaultStars", "availabilityCron", "expirationHours"],
        "additionalProperties": false,
        "properties": {
          "id": {
            "type": "string",
            "pattern": "^[a-zA-Z0-9-_]+$",
            "description": "Unique chore/activity identifier"
          },
          "title": {
            "type": "string",
            "minLength": 1,
            "description": "Display name for the chore/activity"
          },
          "icon": {
            "type": "object",
            "required": ["type", "value"],
            "additionalProperties": false,
            "properties": {
              "type": {
                "type": "string",
                "enum": ["emoji", "image"],
                "description": "Icon type: emoji or image (uploaded filename)"
              },
              "value": {
                "type": "string",
                "minLength": 1,
                "description": "Emoji character or uploaded filename (auto-resolves to /uploads/)"
              }
            }
          },
          "defaultStars": {
            "type": "integer",
            "minimum": 1,
            "description": "Default star reward for completing chore/activity"
          },
          "availabilityCron": {
            "type": "string",
            "pattern": "^[\\d\\*\\-,/]+ [\\d\\*\\-,/]+ [\\d\\*\\-,/]+ [\\d\\*\\-,/]+ [\\d\\*\\-,/]+$",
            "description": "Cron expression for when chore/activity becomes available (5 fields: minute hour day month weekday)"
          },
          "expirationHours": {
            "type": "number",
            "minimum": 0.5,
            "description": "Hours after availability when chore/activity expires if not completed"
          },
          "eligibleUsers": {
            "type": "array",
            "description": "Optional list of user IDs who can claim this chore/activity. If omitted, all users can claim.",
            "items": {
              "type": "string",
              "description": "Reference to user ID"
            }
          },
          "category": {
            "type": "string",
            "enum": ["chore", "bonus"],
            "default": "chore",
            "description": "Category: 'chore' for household tasks, 'bonus' for school/outside achievements"
          }
        }
      }
    },
    "tasks": {
      "type": "array",
      "description": "Library of reusable tasks",
      "items": {
        "type": "object",
        "required": ["id", "title", "icon", "stars"],
        "additionalProperties": false,
        "properties": {
          "id": {
            "type": "string",
            "pattern": "^[a-zA-Z0-9-_]+$",
            "description": "Unique task identifier"
          },
          "title": {
            "type": "string",
            "minLength": 1,
            "description": "Display name for the task"
          },
          "icon": {
            "type": "object",
            "required": ["type", "value"],
            "additionalProperties": false,
            "properties": {
              "type": {
                "type": "string",
                "enum": ["emoji", "image"],
                "description": "Icon type: emoji (Unicode character) or image (uploaded file from /uploads)"
              },
              "value": {
                "type": "string",
                "minLength": 1,
                "description": "Emoji character or icon name"
              }
            }
          },
          "stars": {
            "type": "integer",
            "minimum": 0,
            "description": "Star reward for completing task on time"
          },
          "lateStars": {
            "type": "integer",
            "minimum": 0,
            "description": "Star reward for completing task after time runs out (default: 0)"
          }
        }
      }
    },
    "routines": {
      "type": "array",
      "description": "Template routines (e.g., Morning, Evening)",
      "items": {
        "type": "object",
        "required": ["id", "title", "themeColor", "icon"],
        "additionalProperties": false,
        "properties": {
          "id": {
            "type": "string",
            "pattern": "^[a-zA-Z0-9-_]+$",
            "description": "Unique routine identifier"
          },
          "title": {
            "type": "string",
            "minLength": 1,
            "description": "Display name for the routine"
          },
          "themeColor": {
            "type": "string",
            "description": "CSS color value or var()"
          },
          "icon": {
            "type": "object",
            "required": ["type", "value"],
            "additionalProperties": false,
            "properties": {
              "type": {
                "type": "string",
                "enum": ["emoji", "image"],
                "description": "Icon type: emoji or image (uploaded filename)"
              },
              "value": {
                "type": "string",
                "minLength": 1,
                "description": "Emoji character or uploaded filename (auto-resolves to /uploads/)"
              }
            }
          }
        }
      }
    },
    "routineTasks": {
      "type": "array",
      "description": "Join table mapping routines to tasks with order and duration",
      "items": {
        "type": "object",
        "required": ["id", "routineId", "taskId", "order", "durationSeconds"],
        "additionalProperties": false,
        "properties": {
          "id": {
            "type": "string",
            "pattern": "^[a-zA-Z0-9-_]+$",
            "description": "Unique routine-task mapping identifier"
          },
          "routineId": {
            "type": "string",
            "description": "Reference to routine ID"
          },
          "taskId": {
            "type": "string",
            "description": "Reference to task ID"
          },
          "order": {
            "type": "integer",
            "minimum": 1,
            "description": "Sequence order within routine"
          },
          "durationSeconds": {
            "type": "integer",
            "minimum": 1,
            "description": "Time limit for task completion"
          }
        }
      }
    },
    "users": {
      "type": "array",
      "description": "Children profiles",
      "items": {
        "type": "object",
        "required": ["id", "name", "avatar", "color"],
        "additionalProperties": false,
        "properties": {
          "id": {
            "type": "string",
            "pattern": "^[a-zA-Z0-9-_]+$",
            "description": "Unique user identifier"
          },
          "name": {
            "type": "string",
            "minLength": 1,
            "description": "Child's display name"
          },
          "avatar": {
            "type": "object",
            "required": ["type", "value"],
            "additionalProperties": false,
            "properties": {
              "type": {
                "type": "string",
                "enum": ["emoji", "image"],
                "description": "Avatar type: emoji or image (uploaded filename)"
              },
              "value": {
                "type": "string",
                "minLength": 1,
                "description": "Emoji character or uploaded filename (auto-resolves to /uploads/)"
              }
            }
          },
          "color": {
            "type": "string",
            "description": "CSS color value or var()"
          },
          "grade": {
            "type": "integer",
            "minimum": 1,
            "maximum": 6,
            "description": "School grade (Δημοτικό: 1 = Α' … 6 = ΣΤ'). Picks the daily exercise pool; without it the kid gets no daily exercises"
          },
          "problemReading": {
            "enum": ["marked", "paint", "paint-all"],
            "description": "How the kid reads word problems: tap pre-marked phrases (default), paint the story freehand (unneeded facts greyed out for her), or paint the unneeded facts too"
          }
        }
      }
    },
    "settings": {
      "type": "object",
      "required": ["timezone"],
      "additionalProperties": false,
      "properties": {
        "timezone": {
          "type": "string",
          "pattern": "^[A-Za-z]+/[A-Za-z_]+$",
          "description": "IANA timezone identifier (e.g., Europe/Athens)"
        },
        "exercisesPerDay": {
          "type": "integer",
          "minimum": 0,
          "maximum": 10,
          "description": "Daily school exercises per kid (default 3)"
        },
        "extraProblemsPerDay": {
          "type": "integer",
          "minimum": 0,
          "maximum": 100,
          "description": "Extra problems a kid may ask for each day, on top of the daily ones (default 10; 0 turns the button off)"
        },
        "alarmMinutes": {
          "type": "integer",
          "minimum": 1,
          "maximum": 1440,
          "description": "How long an alarm rings before it gives up, with the rest of its flow (default 60)"
        }
      }
    },
    "routineAssignments": {
      "type": "array",
      "description": "User-specific routine instances",
      "items": {
        "type": "object",
        "required": ["id", "userId", "routineId"],
        "additionalProperties": false,
        "properties": {
          "id": {
            "type": "string",
            "pattern": "^[a-zA-Z0-9-_]+$",
            "description": "Unique assignment identifier"
          },
          "userId": {
            "type": "string",
            "description": "Reference to user ID"
          },
          "routineId": {
            "type": "string",
            "description": "Reference to routine ID"
          }
        }
      }
    },
    "flows": {
      "type": "array",
      "description": "Multi-step sequences (alarm + parallel routines)",
      "items": {
        "type": "object",
        "required": ["id", "steps"],
        "additionalProperties": false,
        "properties": {
          "id": {
            "type": "string",
            "pattern": "^[a-zA-Z0-9-_]+$",
            "description": "Unique flow identifier"
          },
          "steps": {
            "type": "array",
            "minItems": 1,
            "items": {
              "oneOf": [
                {
                  "type": "object",
                  "required": ["type", "props"],
                  "additionalProperties": false,
                  "properties": {
                    "type": {
                      "type": "string",
                      "enum": ["alarm"]
                    },
                    "props": {
                      "type": "object",
                      "additionalProperties": false,
                      "properties": {
                        "sound": {
                          "oneOf": [
                            {
                              "type": "string",
                              "enum": ["melody", "beep"],
                              "description": "Built-in sound: melody (wake-up tune) or beep (simple alarm)"
                            },
                            {
                              "type": "object",
                              "required": ["type", "value"],
                              "additionalProperties": false,
                              "properties": {
                                "type": {
                                  "type": "string",
                                  "enum": ["upload"],
                                  "description": "Custom uploaded audio file"
                                },
                                "value": {
                                  "type": "string",
                                  "minLength": 1,
                                  "description": "Uploaded filename (from /uploads/)"
                                }
                              }
                            }
                          ]
                        },
                        "title": {
                          "type": "string",
                          "minLength": 1,
                          "description": "Alarm title text"
                        },
                        "message": {
                          "type": "string",
                          "description": "Optional message below title"
                        },
                        "icon": {
                          "type": "string",
                          "minLength": 1,
                          "description": "Emoji icon for the alarm"
                        },
                        "dismissText": {
                          "type": "string",
                          "minLength": 1,
                          "description": "Text for the dismiss button"
                        }
                      }
                    }
                  }
                },
                {
                  "type": "object",
                  "required": ["type", "actions"],
                  "additionalProperties": false,
                  "properties": {
                    "type": {
                      "type": "string",
                      "enum": ["parallel"]
                    },
                    "actions": {
                      "type": "array",
                      "minItems": 1,
                      "items": {
                        "oneOf": [
                          {
                            "type": "object",
                            "required": ["type", "userId", "routineId"],
                            "additionalProperties": false,
                            "properties": {
                              "type": {
                                "type": "string",
                                "enum": ["routine"]
                              },
                              "userId": {
                                "type": "string",
                                "description": "Reference to user ID"
                              },
                              "routineId": {
                                "type": "string",
                                "description": "Reference to routine assignment ID"
                              }
                            }
                          },
                          {
                            "type": "object",
                            "required": ["type", "flowId"],
                            "additionalProperties": false,
                            "properties": {
                              "type": {
                                "type": "string",
                                "enum": ["flow"]
                              },
                              "flowId": {
                                "type": "string",
                                "description": "Reference to flow ID"
                              }
                            }
                          }
                        ]
                      }
                    }
                  }
                }
              ]
            }
          }
        }
      }
    },
    "schedules": {
      "type": "array",
      "description": "Cron-based triggers",
      "items": {
        "type": "object",
        "required": ["id", "cron", "type", "targetId"],
        "additionalProperties": false,
        "properties": {
          "id": {
            "type": "string",
            "pattern": "^[a-zA-Z0-9-_]+$",
            "description": "Unique schedule identifier"
          },
          "cron": {
            "type": "string",
            "pattern": "^[\\d\\*\\-,/]+ [\\d\\*\\-,/]+ [\\d\\*\\-,/]+ [\\d\\*\\-,/]+ [\\d\\*\\-,/]+$",
            "description": "Cron expression (5 fields: minute hour day month weekday)"
          },
          "type": {
            "type": "string",
            "enum": ["flow", "routine"],
            "description": "Target type to trigger"
          },
          "targetId": {
            "type": "string",
            "description": "Flow ID or routine assignment ID"
          }
        }
      }
    },
    "rewards": {
      "type": "array",
      "description": "Redeemable rewards with star costs",
      "items": {
        "type": "object",
        "required": ["id", "title", "icon", "cost"],
        "additionalProperties": false,
        "properties": {
          "id": {
            "type": "string",
            "pattern": "^[a-zA-Z0-9-_]+$",
            "description": "Unique reward identifier"
          },
          "title": {
            "type": "string",
            "minLength": 1,
            "description": "Display name for reward"
          },
          "icon": {
            "type": "object",
            "required": ["type", "value"],
            "additionalProperties": false,
            "properties": {
              "type": {
                "type": "string",
                "enum": ["emoji", "image"],
                "description": "Icon type: emoji or image (uploaded filename)"
              },
              "value": {
                "type": "string",
                "minLength": 1,
                "description": "Emoji character or uploaded filename (auto-resolves to /uploads/)"
              }
            }
          },
          "cost": {
            "type": "integer",
            "minimum": 1,
            "description": "Star cost to redeem"
          }
        }
      }
    }
  }
}
