{
  "chores": [
    {
      "id": "chore-dishes",
      "title": "Πλύσιμο Πιάτων",
      "icon": {
        "type": "emoji",
        "value": "🍽️"
      },
      "defaultStars": 20,
      "availabilityCron": "0 18 * * *",
      "expirationHours": 4,
      "category": "chore"
    },
    {
      "id": "chore-evening-test",
      "title": "Βραδινή Δουλειά",
      "icon": {
        "type": "emoji",
        "value": "🌙"
      },
      "defaultStars": 5,
      "availabilityCron": "* * * * *",
      "expirationHours": 1,
      "category": "chore"
    },
    {
      "id": "chore-tidy-room",
      "title": "Τακτοποίηση Δωματίου",
      "icon": {
        "type": "emoji",
        "value": "🛏️"
      },
      "defaultStars": 15,
      "availabilityCron": "0 10 * * 6",
      "expirationHours": 8,
      "eligibleUsers": ["u1", "u2"],
      "category": "chore"
    },
    {
      "id": "chore-vacuum",
      "title": "Σκούπισμα",
      "icon": {
        "type": "emoji",
        "value": "🧹"
      },
      "defaultStars": 25,
      "availabilityCron": "0 11 * * 0",
      "expirationHours": 6,
      "eligibleUsers": ["u1"],
      "category": "chore"
    },
    {
      "id": "chore-water-plants",
      "title": "Πότισμα Φυτών",
      "icon": {
        "type": "emoji",
        "value": "🌱"
      },
      "defaultStars": 10,
      "availabilityCron": "0 9 * * 1,3,5",
      "expirationHours": 12,
      "category": "chore"
    },
    {
      "id": "bonus-school-food",
      "title": "Έφαγα το Φαγητό στο Σχολείο",
      "icon": {
        "type": "emoji",
        "value": "🍱"
      },
      "defaultStars": 15,
      "availabilityCron": "0 14 * * 1-5",
      "expirationHours": 6,
      "category": "bonus"
    },
    {
      "id": "bonus-homework-early",
      "title": "Τέλειωσα τα Μαθήματα στο Σχολείο",
      "icon": {
        "type": "emoji",
        "value": "📚"
      },
      "defaultStars": 20,
      "availabilityCron": "0 14 * * 1-5",
      "expirationHours": 6,
      "category": "bonus"
    },
    {
      "id": "bonus-good-behavior",
      "title": "Καλή Συμπεριφορά στο Σχολείο",
      "icon": {
        "type": "emoji",
        "value": "⭐"
      },
      "defaultStars": 25,
      "availabilityCron": "0 14 * * 1-5",
      "expirationHours": 6,
      "category": "bonus"
    },
    {
      "id": "bonus-helped-friend",
      "title": "Βοήθησα Φίλο/Φίλη",
      "icon": {
        "type": "emoji",
        "value": "🤝"
      },
      "defaultStars": 15,
      "availabilityCron": "0 14 * * 1-5",
      "expirationHours": 6,
      "category": "bonus"
    }
  ],
  "tasks": [
    {
      "id": "t-brush",
      "title": "Πλύσιμο Δοντιών",
      "icon": {
        "type": "emoji",
        "value": "🪥"
      },
      "stars": 10
    },
    {
      "id": "t-wash",
      "title": "Πλύσιμο Προσώπου",
      "icon": {
        "type": "emoji",
        "value": "🧼"
      },
      "stars": 10
    },
    {
      "id": "t-dress",
      "title": "Ντύσιμο",
      "icon": {
        "type": "emoji",
        "value": "👗"
      },
      "stars": 10
    },
    {
      "id": "t-breakfast",
      "title": "Πρωινό",
      "icon": {
        "type": "emoji",
        "value": "🥞"
      },
      "stars": 10
    },
    {
      "id": "t-pajamas",
      "title": "Πιτζάμες",
      "icon": {
        "type": "emoji",
        "value": "👚"
      },
      "stars": 10
    },
    {
      "id": "t-story",
      "title": "Παραμύθι",
      "icon": {
        "type": "emoji",
        "value": "📖"
      },
      "stars": 10
    }
  ],
  "routines": [
    {
      "id": "r-morning",
      "title": "Πρωινή Ρουτίνα",
      "themeColor": "var(--color-primary)",
      "icon": {
        "type": "emoji",
        "value": "☀️"
      }
    },
    {
      "id": "r-evening",
      "title": "Βραδινή Ρουτίνα",
      "themeColor": "var(--color-secondary)",
      "icon": {
        "type": "emoji",
        "value": "🌙"
      }
    }
  ],
  "routineTasks": [
    {
      "id": "rt-1",
      "routineId": "r-morning",
      "taskId": "t-brush",
      "order": 1,
      "durationSeconds": 120
    },
    {
      "id": "rt-2",
      "routineId": "r-morning",
      "taskId": "t-wash",
      "order": 2,
      "durationSeconds": 60
    },
    {
      "id": "rt-3",
      "routineId": "r-morning",
      "taskId": "t-dress",
      "order": 3,
      "durationSeconds": 300
    },
    {
      "id": "rt-4",
      "routineId": "r-morning",
      "taskId": "t-breakfast",
      "order": 4,
      "durationSeconds": 600
    },
    {
      "id": "rt-5",
      "routineId": "r-evening",
      "taskId": "t-pajamas",
      "order": 1,
      "durationSeconds": 180
    },
    {
      "id": "rt-6",
      "routineId": "r-evening",
      "taskId": "t-brush",
      "order": 2,
      "durationSeconds": 120
    },
    {
      "id": "rt-7",
      "routineId": "r-evening",
      "taskId": "t-story",
      "order": 3,
      "durationSeconds": 600
    }
  ],
  "users": [
    {
      "id": "u1",
      "name": "Ηλέκτρα",
      "avatar": {
        "type": "image",
        "value": "1763893864988-1.png"
      },
      "color": "var(--color-accent)"
    },
    {
      "id": "u2",
      "name": "Ιφιγένεια",
      "avatar": {
        "type": "image",
        "value": "1763893873621-2.png"
      },
      "color": "var(--color-secondary)"
    }
  ],
  "settings": {
    "timezone": "Europe/Athens"
  },
  "routineAssignments": [
    {
      "id": "u1-assign-morning",
      "userId": "u1",
      "routineId": "r-morning"
    },
    {
      "id": "u1-assign-evening",
      "userId": "u1",
      "routineId": "r-evening"
    },
    {
      "id": "u2-assign-morning",
      "userId": "u2",
      "routineId": "r-morning"
    }
  ],
  "flows": [
    {
      "id": "morning-flow",
      "steps": [
        {
          "type": "parallel",
          "actions": [
            {
              "type": "flow",
              "flowId": "u1-morning-flow"
            },
            {
              "type": "flow",
              "flowId": "u2-morning-flow"
            }
          ]
        }
      ]
    },
    {
      "id": "u1-morning-flow",
      "steps": [
        {
          "type": "alarm",
          "props": {
            "sound": {
              "type": "upload",
              "value": "1764012149103-rooster-crow-1-281011.mp3"
            },
            "title": "Ώρα για ξύπνημα!",
            "message": "Καλημέρα! ☀️",
            "icon": "⏰",
            "dismissText": "Ξυπνήσαμε!"
          }
        },
        {
          "type": "parallel",
          "actions": [
            {
              "type": "routine",
              "userId": "u1",
              "routineId": "u1-assign-morning"
            }
          ]
        }
      ]
    },
    {
      "id": "u2-morning-flow",
      "steps": [
        {
          "type": "alarm",
          "props": {
            "sound": {
              "type": "upload",
              "value": "1764012149103-rooster-crow-1-281011.mp3"
            },
            "title": "Ώρα για ξύπνημα!",
            "message": "Καλημέρα! ☀️",
            "icon": "⏰",
            "dismissText": "Ξυπνήσαμε!"
          }
        },
        {
          "type": "parallel",
          "actions": [
            {
              "type": "routine",
              "userId": "u2",
              "routineId": "u2-assign-morning"
            }
          ]
        }
      ]
    }
  ],
  "schedules": [
    {
      "id": "sch-morning",
      "cron": "0 7 * * 1-5",
      "type": "flow",
      "targetId": "morning-flow"
    },
    {
      "id": "sch-evening",
      "cron": "0 20 * * *",
      "type": "routine",
      "targetId": "u1-assign-evening"
    }
  ],
  "rewards": [
    {
      "id": "rew-tv",
      "title": "1 Ώρα Τηλεόραση",
      "icon": {
        "type": "emoji",
        "value": "📺"
      },
      "cost": 50
    },
    {
      "id": "rew-sweet",
      "title": "Γλυκό",
      "icon": {
        "type": "emoji",
        "value": "🍬"
      },
      "cost": 30
    },
    {
      "id": "rew-park",
      "title": "Βόλτα στο Πάρκο",
      "icon": {
        "type": "emoji",
        "value": "🌳"
      },
      "cost": 100
    },
    {
      "id": "rew-toy",
      "title": "Μικρό Παιχνίδι",
      "icon": {
        "type": "emoji",
        "value": "🧸"
      },
      "cost": 200
    }
  ]
}